;name;description;referrals;properties;history
214;Darth Vader;Once the heroic Jedi Knight named Anakin Skywalker, Darth Vader was seduced by the dark side of the Force. Forever scarred by his defeat on Mustafar, Vader was transformed into a cybernetically-enhanced Sith Lord. At the dawn of the Empire, Vader led the Empire’s eradication of the Jedi Order and the search for survivors. He remained in service of the Emperor -- the evil Darth Sidious -- for decades, enforcing his Master’s will and seeking to crush the Rebel Alliance and other detractors. But there was still good in him…;['Anakin Skywalker', 'Order', 'Padmé Amidala', 'Palpatine', 'Darth Sidious', 'Jedi Temple', 'Mustafar,', 'Separatist leaders', 'Obi-Wan Kenobi', 'Palpatine’s', 'General Grievous', 'Obi-Wan Kenobi', 'Mapuzo', 'Grand Moff Tarkin', 'Grand Inquisitor', 'Lothal', 'Kanan Jarrus', 'Ezra Bridger', 'Phoenix Squadron', 'Ahsoka Tano', 'Sith Temple on Malachor', 'Anakin Skywalker', 'Mustafar', 'bacta tank', 'Jedha', 'Director Orson Krennic', 'Death Star', 'Rebel Alliance', 'Princess Leia', 'R2-D2', 'Tatooine', 'Luke Skywalker', 'Han Solo', 'Chewbacca', 'C-3PO', 'TIE Advanced starfighter', 'X-wing', 'Millennium Falcon', 'probe droids', 'Hoth', 'Boba Fett', 'Cloud City', 'Bespin', 'lightsaber', 'second Death Star', 'lightsaber', 'Force lightning'];"{'Appearances': ['Star Wars: A New Hope (Episode IV)', 'Star Wars: The Empire Strikes Back (Episode V)', 'Star Wars: Return of the Jedi (Episode VI)', 'Star Wars: Revenge of the Sith (Episode III)', 'Rogue One: A Star Wars Story', 'Obi-Wan Kenobi', 'Star Wars Rebels'], 'Affiliations': ['Galactic Empire', 'Sith'], 'Locations': ['Death Star', 'Death Star II'], 'Gender': ['Male'], 'Dimensions': ['Height: 2.03m '], 'species': ['Human'], 'Vehicles': [""Darth Vader's TIE Fighter""], 'Weapons': [""Darth Vader's lightsaber""]}";
215;Darts D'Nar;A proud Zygerrian, Darts D'Nar longed for the days when Zygerria was once again an influential power in the galaxy. He believed that an alliance with Count Dooku and the Separatists was a step in the path towards rebuilding this former glory, though he was often impatient at the Count's indirect means. To D'Nar, power not flexed is power wasted. With relish, he supervised the conquest of Kiro, and the forced relocation of thousands of Togruta colonists.  A powerfully built Zygerrian, Darts D'Nar was a master of the electro-whip.;;{'Appearances': ['Star Wars: The Clone Wars'], 'Affiliations': ['Confederacy of Independent Systems'], 'Locations': ['Zygerria'], 'Gender': ['Male'], 'Dimensions': ['Height: 1.89m '], 'species': ['Zygerrian'], 'Vehicles': ['Zygerrian Slave Ship']};
216;Daughter;The Daughter of Mortis is a Force-wielder who aligns herself with the light side of the Force. An enigmatic being of tall stature who can transform into a griffin, she is the selfless counterpoint to her brother, the Son, who has allied himself with the dark side. Together they provide balance to the Force, a balance maintained and channeled through their Father.;;{'Appearances': ['Star Wars: The Clone Wars'], 'Locations': ['Mortis'], 'Gender': ['Female'], 'Dimensions': ['Height: 2.13m ']};
217;Daultay Dofine;The unctuous captain of the Neimoidian blockade over Naboo, Dofine was an officer in the Trade Federation. Greedy, deceitful and cowardly, Dofine nevertheless had the wherewithal to openly question Darth Sidious' machinations, for which he was verbally reprimanded by the Sith Lord. Despite his insubordination, Dofine remained in command of the blockade's forces. He gave the order to activate the droids on the surface of Naboo. Dofine perished aboard the Droid Control Ship when Naboo starfighter forces destroyed the vessel.;;{'Appearances': ['Star Wars: The Phantom Menace (Episode I)'], 'Affiliations': ['Trade Federation'], 'Gender': ['Male'], 'Dimensions': ['Height: 1.9m '], 'species': ['Neimoidian'], 'Vehicles': ['Trade Federation Battleship']};
218;Dava Cassamam;Hulking in stature, wearing a protective pressure helmet to keep ammonia gas pumping through her lungs and with a stoic, unreadable sabacc-face, Dava is an intimidating presence at the card table. Preferring the feel of standard gravity worlds to ease her aching back in her off hours, the rest of the time Dava can be found toiling as a deep cloud-miner on gas giant planets.;;{'Appearances': ['Solo: A Star Wars Story'], 'Locations': ['Vandor', 'The Lodge'], 'Gender': ['Female']};
219;Davo Sculdun;Davo Sculdun never really endeared himself to the upper political echelons of his homeworld of Chandrila. A scheming financier and opportunist, he is skilled in the maneuvering of bank funds away from the prying eyes of Imperial auditors.;;{'Appearances': ['Andor']};
220;DD-BD;Before being sold into slavery and put to work in the mining operation center on Kessel, DD-BD was an overeager WDD adminmech working on a Morseerian pirate ship. Unfortunately, the ship was impounded by the Empire, and DD-BD was sold at auction to the Pyke syndicate for a fraction of his worth. But in a chance meeting with L3-37, the small droid is liberated when his restraining botl is removed, igniting a small rebellion.;;{'Appearances': ['Solo: A Star Wars Story'], 'Affiliations': ['Pyke Syndicate'], 'Locations': ['Kessel', 'Kessel Control Center'], 'droid': ['adminmech']};
221;Dedra Meero;Methodical, polished, and ambitious, Dedra Meero embodies the ideals of the Imperial Security Bureau. She is ever vigilant, collecting and analyzing intelligence from across the galaxy to identify possible signs of disorder. Her ingenuity serves her well, climbing the ranks by piecing together a clear picture of rebel activity from disparate parts.;;{'Appearances': ['Andor']};
222;Dengar;Crude and slovenly, Dengar was nonetheless an effective bounty hunter. While some hunters prided themselves on finesse and style, Dengar preferred firepower and destruction. Despite his scruffy-looking and battered exterior, Dengar thought highly of himself, enough to make blunt passes at shapely females that caught his eye. Despite these obnoxious qualities, Boba Fett enjoyed working with Dengar and held him in high regard due to his proven track record in hunting down prey.;;{'Appearances': ['Star Wars: The Empire Strikes Back (Episode V)', 'Star Wars: Return of the Jedi (Episode VI)', 'Star Wars: The Clone Wars'], 'Gender': ['Male'], 'Dimensions': ['Height: 1.87m '], 'Weapons': ['Blaster Rifle']};
223;Depa Billaba;A Chalactan Jedi, Depa Billaba served on the Jedi Council in the final years of the Republic. She witnessed the discovery of Anakin Skywalker, whom Qui-Gon Jinn believed to be the Chosen One, and tried to determine the will of the Force as the galaxy slid into tumult and war. During the Clone Wars Billaba took Caleb Dume on as her Padawan, but was unable to finish his training before the dreaded Order 66 ended her life on Kaller.;;{'Appearances': ['Star Wars: The Phantom Menace (Episode I)', 'Star Wars: Attack of the Clones (Episode II)', 'Star Wars: The Bad Batch'], 'Affiliations': ['Jedi Order'], 'Gender': ['Female'], 'Dimensions': ['Height: 1.68m '], 'Weapons': ['Lightsaber']};
224;Derek 'Hobbie' Klivian;Born on Ralltiir, Derek “Hobbie” Klivian defected to the Rebel Alliance with Biggs Darklighter and flew with Rogue Squadron during the Battle of Hoth. He served as Luke Skywalker’s wingman during the defense of Echo Base, ejecting from his snowspeeder just before the craft rammed an AT-AT.;['Skystrike Academy', 'Wedge Antilles', 'Sabine Wren', 'TIE bomber'];{'Appearances': ['Star Wars: The Empire Strikes Back (Episode V)', 'Star Wars Rebels'], 'Affiliations': ['Rebel Alliance', 'Rebel Pilots'], 'Locations': ['Hoth', 'Echo Base', 'Skystrike Academy'], 'Gender': ['Male'], 'Dimensions': ['Height: 1.75m '], 'species': ['Human'], 'Weapons': ['Blaster Pistol'], 'Vehicles': ['X-wing Starfighter', 'Snowspeeder']};
225;Derla Pidys;A noted sommelier, Derla Pidys sells wine gathered from a breathtaking range of worlds: Orto Plutonia, Naboo, the Forest Moon of Endor and many others. It’s a profession that has brought her into contact with Canto Bight business owners such as Ubailla Gheal, as well as patrons such as the mysterious Grammus sisters.;;{'Appearances': ['Star Wars: The Last Jedi (Episode VIII)'], 'Locations': ['Canto Bight'], 'Gender': ['Female']};
226;Derrown;It's easy to misjudge the deadliness of a gasbag. Derrown was a Parwan bounty hunter, an alien species with a lighter-than-air physiology that allowed him to float about on air currents, anchoring himself with four leg-like tentacles and two arms. His buoyancy let him reach heights and vantage points not easily accessible to standard density competitors, but he lacked the speed and control that came with mass. The Parwan biology produces intense electrical fields -- Derrown literally crackled with energy, earning him the grisly moniker the Exterminator. To prevent any ill-effects with his carried explosives, he kept them safe in an insulated bandolier across his shoulders.;;{'Appearances': ['Star Wars: The Clone Wars'], 'Gender': ['Male'], 'Dimensions': ['Height: 2.21m '], 'species': ['Parwan']};
227;Desix;At the dawn of the Empire, many worlds remain unaffiliated with the new regime, subject to being assimilated one by one. Led by Governor Tawni Ames, the world of Desix is a rust-colored oasis with sprawling hills and sand, resistant to bowing before a new master. ;;{'Appearances': ['Star Wars: The Bad Batch']};
228;Dewi Pamular;The chattier of the two Pamular brothers, Dewi spends much of his time in the Narkina quarry pools, hunting for edible fish in the murky waters. Dewi has no love for the Empire that has poisoned his home, and he retains compassion for others who have been similarly scarred by the Imperial machine.;;{'Appearances': ['Andor']};
229;Dex Tiree;Dex Tiree was a human pilot from Onderon who fought with distinction at the Battle of Yavin under the designation “Gold Two.” He was Jon “Dutch” Vander’s wingman, piloting a Y-Wing with the rest of Gold Squadron in the assault on the Death Star. Sadly, he was the first pilot hit when the Dark Lord of the Sith Darth Vader arrived in his TIE Advanced.;;{'Appearances': ['Star Wars: A New Hope (Episode IV)'], 'Affiliations': ['Rebel Alliance'], 'Locations': ['Onderon', 'Yavin 4'], 'Gender': ['Male'], 'species': ['Human'], 'Weapons': ['Blaster Pistol'], 'Vehicles': ['Y-wing Starfighter']};
230;Dexter Jettster;Obi-Wan Kenobi counted on Dexter Jettster, an old friend, to identify a poison dart, and Jettster didn't fail him. The cook correctly recognized the small-tined projectile as a Kamino saberdart. Few have ever heard of the planet Kamino, but Dex not only informed Obi-Wan as to its location (12 parsecs south of the Rishi Maze), but also its inhabitants. Dex warned that the native Kaminoans -- cloners of some repute -- keep to themselves, but are welcoming to those with the credits to spare.;;{'Appearances': ['Star Wars: Attack of the Clones (Episode II)'], 'Locations': ['Coruscant'], 'Gender': ['Male'], 'Dimensions': ['Height: 1.88m '], 'species': ['Besalisk']};
231;Director Orson Krennic;As director of Advanced Weapons Research for the Imperial military, Orson Krennic is obsessed with the completion of the long-delayed Death Star project. A cruel but brilliant man, Krennic has staked his reputation on the delivery of the functional battle station to the Emperor.;;"{'Appearances': ['Rogue One: A Star Wars Story'], 'Gender': ['Male'], 'Weapons': [""Krennic's DT-29 Heavy Blaster Pistol""]}";
232;DJ;An amoral thief and talented slicer, DJ dwells in the shadows thrown off by Canto Bight’s glitz, stealing whatever he needs and resolutely refusing to take sides in the growing conflict between the First Order and the Resistance.;['Canto Bight', 'First Order', 'Resistance', 'Finn', 'Rose'];{'Appearances': ['Star Wars: The Last Jedi (Episode VIII)'], 'Locations': ['Canto Bight'], 'Gender': ['Male'], 'species': ['Human']};
233;DJ R-3X;Rex, a former pilot of a Starspeeder 3000 for Star Tours, was recently reprogrammed to be a DJ in Oga’s Cantina. Today, he can be found playing the latest hits from around the galaxy in the heart of Black Spire Outpost. As quirky and talkative as ever, he’s still trying to do his best on the job.;;{'Locations': ['Oga’s Cantina'], 'star wars': ['Droid']};
234;Doctor Aphra;Endlessly inventive and completely unpredictable, Doctor Chelli Lona Aphra is one of the galaxy's most daring treasure hunters. The rogue archaeologist studied at the University of Bar’leth where she received her doctorate under duress before she was recruited by Darth Vader. Among her misadventures, she’s joined forces with Luke Skywalker and kidnapped Hera Syndulla. But despite questionable morals and equally bad judgement, her luck hasn’t run out yet.;;{'Gender': ['Female'], 'species': ['Human']};
235;Doctor Cornelius Evazan;A grubby, scarred smuggler from Alsakan, Cornelius Evazan was once a promising surgeon, but became notorious for conducting cruel medical experiments. Dr. Evazan tried to bully Luke Skywalker in the Mos Eisley cantina, boasting that he faced a death sentence in 12 systems. The doctor and his pal Ponda Baba assumed the young farmboy would be an easy target, and paid little heed to the old man in dusty robes who’d accompanied young Luke into the bar. That was a fatal mistake: when Evazan hurled Luke aside and pulled his blaster, Obi-Wan Kenobi coolly ignited his lightsaber and cut Evazan down.;;{'Appearances': ['Star Wars: A New Hope (Episode IV)', 'Rogue One: A Star Wars Story'], 'Locations': ['Tatooine'], 'Gender': ['Male'], 'Dimensions': ['Height: 1.7m '], 'Weapons': ['Blaster Pistol']};
236;Doctor Gubacher;A researcher and engineer serving the Jedi Council, Doctor Gubacher was tasked with ensuring the droids attached to the Jedi Order were kept in optimum operational condition. With the outbreak of the Clone Wars, Gubacher was given special assignment to modify the droids for specific missions. The manic Parwan scientist developed the modifications required by the droids of D-Squad to carry out their mission to capture a vital Separatist encryption module.;;{'Appearances': ['Star Wars: The Clone Wars'], 'Affiliations': ['Galactic Republic'], 'Gender': ['Male'], 'species': ['Parwan']};
237;Doctor Kalonia;A good-humored, sympathetic physician with the rank of major in the Resistance army, Doctor Kalonia is assigned to the Resistance base on D’Qar. She attended both Chewbacca and Finn after they were wounded. Her calm bedside manner and knowledge of Shyriiwook soothed Chewie, who allowed Kalonia to tend to his blaster burn.;;{'Appearances': ['Star Wars: The Force Awakens (Episode VII)'], 'Affiliations': ['The Resistance'], 'Gender': ['Female']};
238;Doctor Nuvo Vindi;Dr. Nuvo Vindi, a brilliant but demented Separatist scientist, tried to release the deadly Blue Shadow Virus during the Clone Wars. Working from a secret lab on Naboo, Dr. Vindi plotted a catastrophic outbreak that was foiled when the Republic found a cure before his virus could spread.;;{'Appearances': ['Star Wars: The Clone Wars'], 'Affiliations': ['Confederacy of Independent Systems'], 'Gender': ['Male'], 'Dimensions': ['Height: 2.07m '], 'Weapons': ['Blue Shadow Virus']};
239;Doctor Quadpaw;In a dimly lit operating theater on the world of Frezno, the surgeon known only as Doctor Quadpaw tends to desperate patients with nowhere else to turn. With the help of cybernetic enhancements to sharpen his sight and hearing, and four dexterous organic arms, the skilled physician works swiftly to help those in need -- provided they have the credits to pay.;;{'Appearances': ['Andor']};
240;Dok-Ondar;Dok-Ondar is an infamous collector who buys, sells, and trades rare and valuable relics in his Den of Antiquities in Black Spire Outpost. Known as the gatekeeper of the black market, he has amassed an impressive collection of unique artifacts that is unrivaled in the galaxy. A mysterious Ithorian with an even more mysterious past, Dok-Ondar is sought after for his knowledge and connections. ;;{'Locations': ['Batuu', 'Black Spire Outpost', 'Dok-Ondar’s Den of Antiquities'], 'species': ['Ithorians']};
241;Dokk Strassi;One of the crime bosses operating out of Mos Espa, Dokk Strassi controls a section of the city. But even words of respect can sound threatening when hissed by a reptilian Trandoshan.;;{'Appearances': ['The Book of Boba Fett'], 'Locations': ['Tatooine'], 'species': ['Trandoshan']};
242;Drell;As part of Kragan Gorr's pirate gang, Drell is a competent crewman entrusted with important missions, who seems to derive a warped sense of joy from wreaking havoc in the galaxy and shooting down enemy fighters.  But despite his fearsome appearance and gruff attitude, his skills are no match for the First Order.;;{'Appearances': ['Star Wars Resistance'], 'Gender': ['Male'], 'species': ['Weequay']};
243;Droopy McCool;Droopy McCool played the chindinkalu flute in the Max Rebo Band, an ensemble that performed as Jabba's palace band on Tatooine. A veteran musician, Droopy was used to seedy dives and gigs for unsavory clients. But the depravity he saw in Jabba's court shocked even him.;;{'Appearances': ['Star Wars: Return of the Jedi (Episode VI)'], 'Affiliations': ['The Max Rebo Band'], 'Gender': ['Male'], 'Dimensions': ['Height: 1.58m ']};
244;Dryden Vos;The public face of the Crimson Dawn crime syndicate, Dryden Vos is a contradiction: a pitiless enforcer known as a gangster of wealth and taste. Vos socializes with the galaxy’s elite aboard his lavishly appointed yacht First Light, and enjoys showing off his superb collection of antiquities. His good manners shouldn’t be mistaken for weakness, though: he can change from generous host to ruthless killer in a moment.;['Crimson Dawn', 'Vandor', 'Tobias Beckett', 'Han Solo', 'coaxium', 'Qi’ra', 'Kessel', 'Savareen', 'Kyuzo petar'];{'Appearances': ['Solo: A Star Wars Story'], 'Affiliations': ['Crimson Dawn'], 'Gender': ['Male'], 'Dimensions': ['Height: 1.92m '], 'Vehicles': ['First Light'], 'Weapons': ['Kyuzo petars']};
245;DT-F16;A squad commander, death trooper DT-F16 leads with strength and the ability to know when to fight and when to retreat. She suffers no fools and demands the best from those around her.;;{'Appearances': ['Star Wars Rebels'], 'Affiliations': ['Galactic Empire'], 'Gender': ['Female']};
246;Duchess Satine Kryze;The leader of Mandalore during the Clone Wars, Duchess Satine of Kalevala was a controversial figure. She longed to move Mandalore beyond its violent past and instituted a government that valued pacifism. Though Mandalore did begin to rebuild under her guidance, the dark shadow of the Clone Wars made the Duchess' goals difficult to achieve.;['Mandalore', 'Death Watch', 'Separatists', 'Pre Vizsla', 'Darth Maul', 'Obi-Wan Kenobi', 'Bo-Katan'];{'Appearances': ['Star Wars: The Clone Wars'], 'Locations': ['Mandalore'], 'Gender': ['Female'], 'Dimensions': ['Height: 1.77m ']};
247;Dume;With the birth name of fallen Jedi Kanan Jarrus, Dume is a large Loth-wolf -- even by the species' own standards. The creature's origin unknown, he communes directly with Padawan learner Ezra Bridger.;;{'Appearances': ['Star Wars Rebels'], 'Locations': ['Lothal'], 'Gender': ['Male'], 'Creature': ['Loth-wolf']};
248;Dyro Felldor;Dyro acted as a representative for the Er'Kit people and sought the help of Saponza and his partner in ridding the world of a terrorist sect of a slavery operation on Er'Kit, known as the Blood Dawn. After the campaign and eventual defeat of the Blood Dawn, Felldor relayed his gratitude but offered no alliance with his new associates. Upon return to the world, Saponza and his partner discovered that Dyro had been taking part in a power struggle, and was manipulating both the Alliance and the Empire to serve his greedy purposes.;;"{'Locations': [""Er'Kit""], 'Gender': ['Male'], 'species': [""Er'Kit""]}";
249;Echo;Former ARC Trooper Echo joined the Bad Batch towards the end of the Clone Wars after his rescue from the Techno Union. During his years as a soldier in the Grand Army of the Republic, Echo proved to be among the bravest clones, integral in the defense of Rishi Station and Tipoca City. As part of Clone Force 99, Echo's knowledge of proper military tactics and strategy provides valuable insight, while his socket-arm and cybernetic implants give him the unique ability to interact with computer systems. ;['Kamino', 'Separatists', 'Rishi Moon listening post', 'Fives', 'Anakin Skywalker', 'Obi-Wan Kenobi', 'the Citadel', 'Captain Rex', 'Anakin Skywalker', 'the Bad Batch', 'Skako Minor', 'Anaxes', 'Captain Rex', 'Clone Force 99', 'the Emperor', 'Kamino', 'Onderon', 'Omega', 'Crosshair', 'Admiral Tarkin', 'Tech', 'Ordo Moon', 'Pantora', 'Clone Captain Rex', 'inhibitor chips', 'Bracca', 'the Empire', 'Kamino', 'Serenno'];"{'Appearances': ['Star Wars: The Bad Batch', 'Star Wars: The Clone Wars'], 'Affiliations': ['Galactic Republic', 'Clone Troopers', 'Clone Force 99 ""The Bad Batch""'], 'Locations': ['Kamino'], 'Gender': ['Male'], 'Dimensions': ['Height: 1.83m '], 'Weapons': ['Blaster Pistol']}";
250;Edrio Two Tubes;Edrio Two Tubes is a mercenary pilot who flies alongside his eggmate, Benthic. They share the nickname derived from the breathing apparatus that allows Tognath physiology to process oxygen atmospheres. Edrio’s native world of Yar Togna was conquered and occupied by the Empire, forcing him to flee as a refugee. With a desire to strike back at the Empire, Edrio and Benthic have allied with Saw Gerrera.;"['Gerrera', 'Faos Station', 'U-wing', 'kyber crystal', 'Jedha', ""Empire's"", 'Death Star']";{'Appearances': ['Rogue One: A Star Wars Story', 'Star Wars Rebels'], 'Gender': ['Male']};
251;Eedy Karn;Eedy Karn raised her son, Syril, to succeed. After a botched mission to Ferrix costs him his job with Pre-Mor Corporate Security, the ever-judgmental Eedy coldly welcomes him home to Coruscant, berating her son yet still willing to work what connections she has to ensure his prosperity.;;{'Appearances': ['Andor']};
252;Eesh Fahm;Eesh Fahm was a miner on Ibaar, a world devastated by the Empire. He ran an underground network that sought to help his people, and worked with the rebellion to bring food and supplies past the Imperial blockade.;;{'Appearances': ['Star Wars Rebels'], 'Locations': ['Ibaar'], 'Gender': ['Male']};
253;Eeth Koth;Eeth Koth was a member of the Jedi High Council in the final years of the order. From within the polished towers of the Jedi Temple on Coruscant, the Council governed the actions of the Jedi Knights. Koth was one of the 12 Jedi present when Qui-Gon Jinn presented Anakin Skywalker as the Chosen One to the Council. A determined warrior with a deep, spiritual connection to the Force, Koth resisted torture at the hands of General Grievous during the Clone Wars, and was even able to secretly communicate his location to the Jedi Council. Koth was saved from Separatist clutches by the daring efforts of his fellow Jedi.;;{'Appearances': ['Star Wars: The Phantom Menace (Episode I)', 'Star Wars: Attack of the Clones (Episode II)', 'Star Wars: The Clone Wars'], 'Affiliations': ['Jedi Order'], 'Gender': ['Male'], 'Dimensions': ['Height: 1.87m '], 'Weapons': ['Lightsaber']};
254;EG-86;On the surface, a harmless gonk power droid. Underneath, a courier holding secrets vital to the rebellion. EG-86, custodian of important information and data, was sent to rendezvous with Sabine and Ezra of the Ghost crew. While the Mandalorian and Padawan didn’t expect a gonk droid, neither would the Empire, making EG-86 a wise choice.;;{'Appearances': ['Star Wars Rebels'], 'droid': ['Gonk Droid']};
255;EGL-21 'Amps' Power Droid;Like his mechanical colleague Geetaw, Amps was an autonomous droid who traded his services to scavengers at Niima Outpost. The two droids could sometimes be spotted in the shade trading jokes that their customers had brought them.;;{'Appearances': ['Star Wars: The Force Awakens (Episode VII)'], 'Locations': ['Jakku', 'Niima Outpost'], 'star wars': ['Droid']};
256;Eighth Brother Inquisitor;Nimble and menacing, the Eighth Brother was a deadly Terrelian Jango Jumper Inquisitor. Dispatched by Darth Vader, he was sent to Malachor to attempt to find and capture Maul, and instead found himself face to face with Ezra Bridger, Kanan Jarrus, and Ahsoka Tano. The Eighth Brother often used his double-bladed, spinning lightsaber to propel himself through the air, making for sneak attacks and quick escapes. This method proved unwise, however, when he jumped off the edge of the Malachor Sith Temple with his damaged lightsaber, and fell to his death.;;{'Appearances': ['Star Wars Rebels'], 'Gender': ['Male']};
257;Eila;Eila, like more and more unfortunate souls throughout the galaxy, knows the wrath of the First Order and Kylo Ren firsthand. Having survived their raid of her village on Tehar, she and her brother Kel snuck aboard a cargo ship, leaving the smoldering ashes of their homeworld behind. Now, the siblings hide out on the Colossus...until a bounty on their heads attracts the attention of Kazuda Xiono and the First Order.;['the First Order', 'Kaz', 'Neeku', 'Chelidae', 'Colossus', 'Kel'];{'Appearances': ['Star Wars Resistance'], 'Gender': ['Female']};
258;Elan Sleazebaggano;The aptly named Elan Sleazebaggano made his living selling death sticks to patrons of the Outlander Club and other hot spots in the underlevels of Coruscant. Always in search of credits, Sleazebaggano targeted both desperate addicts and unwise thrill-seekers.;;{'Appearances': ['Star Wars: Attack of the Clones (Episode II)'], 'Locations': ['Coruscant'], 'Gender': ['Male'], 'Dimensions': ['Height: 1.78m '], 'species': ['Balosar'], 'Weapons': ['Death Sticks']};
