;name;description;referrals;properties;history
655;R2-D2;A reliable and versatile astromech droid, R2-D2 has served Padmé Amidala, Anakin Skywalker, and Luke Skywalker in turn, showing great bravery in rescuing his masters and their friends from many perils. A skilled starship mechanic and fighter pilot's assistant, he has an unlikely but enduring friendship with the fussy protocol droid C-3PO.;['Trade Federation', 'Amidala', 'Naboo Royal Starship', 'Jar Jar Binks', 'Qui-Gon Jinn', 'Tatooine', 'C-3PO', 'Anakin Skywalker', 'Naboo N-1 starfighter', 'Naboo', 'Jango Fett', 'Separatist', 'Geonosis', 'Geonosians', 'droid factory', 'Republic', 'D-Squad', 'Colonel Meebur Gascon', 'Abafar', 'Gregor', 'Yoda', 'Dagobah', 'Moraband', 'Palpatine', 'Jedi starfighter', 'buzz droid', 'Empire', 'Captain Antilles', 'Rebellion', 'Death Star', 'Darth Vader', 'Tantive IV', 'stormtroopers', 'Leia Organa', 'Jawas', 'Owen Lars', 'Luke Skywalker', 'Beru', 'Han Solo', 'Chewbacca', 'X-wing', 'Hoth', 'Dagobah', 'Yoda', 'Cloud City', 'Darth Vader', 'Jabba the Hutt', 'Sarlacc', 'Endor', 'Death Star II', 'Ewok', 'Resistance', 'D’Qar', 'BB-8', 'Luke’s', 'Rey', 'Chewbacca', 'Ahch-To', 'the Resistance', 'Crait', 'Leia', 'Pasaana', 'Kef Bir', 'Poe Dameron’s', 'Exegol'];{'Appearances': ['Star Wars: A New Hope (Episode IV)', 'Star Wars: The Empire Strikes Back (Episode V)', 'Star Wars: Return of the Jedi (Episode VI)', 'Star Wars: The Phantom Menace (Episode I)', 'Star Wars: Attack of the Clones (Episode II)', 'Star Wars: Revenge of the Sith (Episode III)', 'Star Wars: The Force Awakens (Episode VII)', 'Rogue One: A Star Wars Story', 'Star Wars: The Last Jedi (Episode VIII)', 'Star Wars: The Rise of Skywalker (Episode IX)', 'The Mandalorian', 'Obi-Wan Kenobi', 'The Book of Boba Fett', 'Star Wars: The Clone Wars', 'Star Wars Rebels'], 'Affiliations': ['Rebel Alliance', 'Galactic Republic', 'The Resistance'], 'Locations': ['Naboo', 'Havoc Outpost'], 'Dimensions': ['Height: 1.09m '], 'droid': ['Astromech Droid'], 'Vehicles': ['X-wing Starfighter', 'Poe Dameron’s X-wing fighter', 'Jedi Starfighter'], 'Tool': ['Restraining Bolt']};
656;R23-X9;Torra Doza's droid R23-X9 is the latest model in its series, a pristine culmination of cutting edge robotic tech customized to match her state-of-the-art ship.;;{'Appearances': ['Star Wars Resistance'], 'Locations': ['Colossus'], 'star wars': ['Droid']};
657;R3-A3;Temperamental and territorial, R3-A3 served the Iron Squadron crew aboard Sato’s Hammer. The astromech droid maintained the ship, and while initially bristling at help from the Ghost, came to form a strong duo with Chopper. The two worked together to restore the Hammer’s hyperdrive, and later removed a magno-mine from the ship’s hull.;;"{'Appearances': ['Star Wars Rebels'], 'Locations': ['Mykapo'], 'droid': ['Astromech Droid'], 'Vehicles': [""Sato's Hammer""]}";
658;R3-S1;Threece is the chief of the astromech pool at the Massassi base, where she ensures the Alliance’s technology is kept up to date and in prime condition. Threece has her programming quirks: she’s vain, argumentative and inordinately proud of her overclocked Intellex V processor. But her talent for organization is highly valued by the rebels.;;{'Appearances': ['Rogue One: A Star Wars Story'], 'Affiliations': ['Rebel Alliance'], 'Dimensions': ['Height: 1.09m '], 'droid': ['Astromech Droid']};
659;R3-S6;"A replacement droid assigned to Anakin Skywalker during the Clone Wars after the loss of R2-D2, R3-S6 was a newer model at the time, the latest in astromech technology. Anakin never warmed up to the little black and gold droid; in fact, he grew impatient with ""Goldie"" due to numerous malfunctions and slip ups in the thick of combat. In truth, R3-S6 was secretly a double-agent programmed by the Separatists.";;{'Appearances': ['Star Wars: The Clone Wars'], 'Affiliations': ['Galactic Republic', 'Confederacy of Independent Systems'], 'Dimensions': ['Height: 1.09m '], 'droid': ['Astromech Droid'], 'Vehicles': ['Jedi Starfighter']};
660;R4-D12;Marcus Speedstar may be a flashy celebrity to racing fans, but he takes care to surround himself with those he can trust. When it comes to a race where the stakes are life-and-death for his mechanic Oplock, only his old astromech, R4-D12, in the droid socket of his impressive craft, can help him navigate the course with finesse.;;{'Appearances': ['Star Wars Resistance'], 'star wars': ['Droid']};
661;R4-G77;Every Ace pilot needs a trusty astromech, and as the Aces' top racer defending the Colossus platform, Hype Fazon counts on R4-G77 to keep him front and center and in the spotlight. The droid's uniquely oblong design is crafted for aerodynamic performance, with a bright green color scheme that matches Hype's ship.;;{'Appearances': ['Star Wars Resistance'], 'Locations': ['Colossus'], 'star wars': ['Droid']};
662;R4-P17;R4-P17 was an astromech droid assigned to Obi-Wan Kenobi, and assisted the Jedi Master on many missions, from Kamino and Geonosis to Teth and Tatooine. She was destroyed during the Battle of Coruscant when buzz droids swarmed Obi-Wan’s fighter, ripping the faithful droid’s dome from her metal body.;;{'Appearances': ['Star Wars: Attack of the Clones (Episode II)', 'Star Wars: Revenge of the Sith (Episode III)', 'Star Wars: The Clone Wars'], 'Affiliations': ['Jedi Order'], 'Dimensions': ['Height: 1.09m '], 'droid': ['Astromech Droid']};
663;R5-D4;A red astromech droid, R5-D4 thought he'd found a home when the Jawas sold him to Owen Lars, along with the protocol droid C-3PO. But R5's motivator blew as he rolled away from the sandcrawler, forcing the Jawas to take him back in exchange for R2-D2.;;{'Appearances': ['Star Wars: A New Hope (Episode IV)'], 'Locations': ['Tatooine'], 'Dimensions': ['Height: 0.97m '], 'droid': ['Astromech Droid']};
664;R5-G9;Like the Black Ace itself, Griff Halloran's astromech co-pilot R5-G9 has been cobbled together from Imperial-issue droids and other assorted parts, including an old R2 unit.;;{'Appearances': ['Star Wars Resistance'], 'Locations': ['Colossus'], 'star wars': ['Droid']};
665;R7-A7;Every pilot needs a trusty droid, and R7-A7 proved again and again to be Ahsoka Tano's faithful friend. In her most desperate hour, as Order 66 unfolded and the clones turned their blasters on her, R7-A7 patched into the central computer to help Ahsoka piece together the meaning of Rex's mutterings. After the war, the droid serves as the astromech and co-pilot aboard Trace and Rafa Martez's ship, the Silver Angel.;;{'Appearances': ['Star Wars: The Bad Batch', 'Star Wars: The Clone Wars'], 'star wars': ['Droid'], 'Vehicles': ['The Silver Angel']};
666;Rae Sloane;With Emperor Palpatine dead, a new Imperial leader has emerged from the chaos after Endor -- Admiral Rae Sloane, a decorated veteran with a vision for the Empire’s future. Sloane believes that the Empire has purged itself of weakness and corruption, and that those who remain are worthy to uphold the Empire’s ideals. Uncompromising and tactically brilliant, Sloane holds the remaining Imperial loyalists together with an iron will.;;{};
667;Rafa;The eldest of two sisters, during the Clone Wars Rafa Martez ran a galactic laundry facility she won gambling, while making her real living through illegal jobs with the denizens of the Coruscant underworld. Trusting only her sister, Trace, the two siblings learned that they could only count on each other to survive. But with the Empire now in power, Rafa's faith in her sister remains, yet she finds herself choosing a side.;['Pyke Syndicate', 'Trace', 'Kessel', 'Trace', 'Ziro the Hutt', 'Ahsoka', 'Trace'];{'Appearances': ['Star Wars: The Bad Batch', 'Star Wars: The Clone Wars'], 'Vehicles': ['The Silver Angel']};
668;Rake Gahree;"Among the most promising cadets at the Empire’s Skystrike Academy was Rake Gahree. Secretly, however, Rake wished to leave his Imperial life behind and join the rebellion. But it was not meant to be; during an attempt to escape with undercover rebel Sabine Wren and two fellow trainees, Governor Pryce remotely disabled their ships. She ordered one of the fighters -- now defenseless and floating listlessly -- destroyed, and Rake was no more.";;{'Appearances': ['Star Wars Rebels'], 'Gender': ['Male'], 'species': ['Human']};
669;Rako Hardeen;Rako Hardeen had aspirations for greatness -- he wanted to stand shoulder-to-shoulder among the legendary bounty hunters of his era, hired guns like Cad Bane, Embo and Twazzi. A crack shot, he was reputed to be the best marksman from Concord Dawn, but he never gained the notoriety he desired. That is, until the day he killed Obi-Wan Kenobi...    Hardeen was hired by a mysterious client to target Kenobi. He succeeded, just barely outrunning Kenobi's vengeful former apprentice, Anakin Skywalker. Hiding out in the seamy depths of Coruscant, Rako was shocked to discover his client was the Jedi Council. it was part of a secret plot to replace Hardeen with a Jedi agent to infiltrate the criminal underworld.;;{'Appearances': ['Star Wars: The Clone Wars'], 'Locations': ['Concord Dawn'], 'Gender': ['Male'], 'Dimensions': ['Height: 1.89m '], 'Vehicles': ['Speeder Bike'], 'Weapons': ['Blaster Pistol', 'Blaster Rifle']};
670;Ram Jomaram;"Padawan Ram Jomaram of the Valo Temple is a natural tinkerer; for him, mechanics are meditation. His favorite place to be is a dingy, dim garage full of rusty mechanical parts and tools, among some big eared long-tailed furballs: the Bonbraks. After mistaking his clunky, rusted droid V-18 for cargo, he painted it purple. Ram hates the idea of a fight and his lightsaber technique leaves much to be desired, but where he lacks in fighting finesse he makes up for in his mechanical prowess and big heart.";;{'Appearances': ['Star Wars: The High Republic']};
671;Rancor;Rancors are towering hulks of muscle and reptilian flesh that walk on two stubby legs and use their disproportionately long arms to capture prey. A salivating, tooth-filled maw dominates their flat faces, and their armored skin is so tough that they can shrug off blaster bolts as little more than annoyances. While not inherently vicious -- Felucia’s farmers co-existed relatively peaceably with spined, brightly colored jungle rancors -- these creatures were prized as trophies by crimelords and other wealthy, amoral individuals. Jabba the Hutt kept a rancor in a shadowy chamber beneath his Tatooine throne room. After Luke Skywalker killed the beast, an outraged Jabba ordered the public execution of the Jedi and his friends.;;{'Appearances': ['Star Wars: Return of the Jedi (Episode VI)', 'Star Wars: The Bad Batch', 'The Book of Boba Fett', 'Star Wars: The Clone Wars'], 'Dimensions': ['Height: 5.0m ']};
672;Rancor keeper;Every rancor needs a rancor keeper. When the Hutt twins gift a bound beast to Boba Fett, the creature comes with a grizzled rancor keeper who keeps a close eye on the rancor's training and care.;;{'Appearances': ['The Book of Boba Fett']};
673;Raney;The leader of an encampment of Zygerrian slave traders holed up on Ord Mantell, Raney and his soldiers take advantage of the end of the Republic by amassing human and Falleen slaves, among other captives. A scar bisecting his face and one milky, sightless eye suggest hardwon battles of his past, preparing him for a return to Kadavo to rebuild the Zygerrian empire.;;{'Appearances': ['Star Wars: The Bad Batch'], 'Gender': ['Male'], 'species': ['Zygerrian']};
674;Ranzar 'Ran' Malk;"Ranzar ""Ran"" Malk operates out of the Roost space station and is highly skilled at putting together just the right crew for the task at hand.";;{'Appearances': ['The Mandalorian']};
675;Rappertunie;A green-skinned Shawda Ubb, Rappertunie played a peculiar instrument known as a Growdi Harmonique. He used his fingers, toes and mouth to supplement the wall of sound that was the Max Rebo Band at full strength.;;{'Appearances': ['Star Wars: Return of the Jedi (Episode VI)'], 'Affiliations': ['The Max Rebo Band'], 'Locations': ['Tatooine'], 'Gender': ['Male'], 'Dimensions': ['Height: 0.3m ']};
676;Raspar Six;As the manager of a rundown refueling depot at Ro Station, Raspar scrapes by through a mix of honest work, under-the-table bribes, and the occasional secret alliance with bounty hunters.;;{'Appearances': ['Star Wars: The Bad Batch'], 'Locations': ['Pantora']};
677;Ratts Tyerell;Ratts Tyerell was the tiniest of the Podracer pilots in the Boonta Eve Classic, though size matters not in such a competition. The little scrapper piloted a Podracer with immense engines ... too big, it would seem, for the tight confines of the Laguna Caves. On the second lap of the race, Ratts' accelerator jammed, and he couldn't get clearance past the rocky stalactites. The resulting fireball killed the little guy. His family, who had traveled to Mos Espa to witness the race, was reportedly seen grieving shortly thereafter.;;{'Appearances': ['Star Wars: The Phantom Menace (Episode I)'], 'Affiliations': ['Boonta Eve Classic Podracer Pilots'], 'Locations': ['Aleen'], 'Gender': ['Male'], 'Dimensions': ['Height: 0.79m '], 'species': ['Aleena'], 'Vehicles': ['Podracer']};
678;Razoo Qin-Fee;A lieutenant of Kanjiklub leader Tasu Leech, Razoo Qin-Fee was a pyromaniac and tech expert, notable for having been banned from the underworld Zygerrian fighting circuit for cheating. That was quite an accomplishment in a sport without rules.;;{'Appearances': ['Star Wars: The Force Awakens (Episode VII)'], 'Affiliations': ['Kanjiklub'], 'Gender': ['Male'], 'species': ['Human'], 'Weapons': ['Blaster Rifle']};
679;Reath Silas;"Reath Silas is a skillful Padawan who has had a somewhat privileged apprenticeship; his master, the great Jora Malli, is a member of the Jedi Council. Reath has spent a great deal of time on Coruscant in elevated diplomatic meetings, and prefers books and studying to the thrills and dangers of real adventure, which makes him reluctant to leave the familiar comforts of Coruscant for the frontier. Facing the great unknowns of the frontier will put Reath to the test, and he will learn what he is really made of. ";;{'Appearances': ['Star Wars: The High Republic']};
680;Rebolt;Rebolt is one of Moloch’s most-feared enforcers, threatening the other scrumrats with a savaging from his Corellian hounds and blows from his hand-crafted staff. Rebolt hoped to become Proxima’s Head Boy, but was passed over in favor of Qi’ra, a perceived slight he still resents.;;"{'Appearances': ['Solo: A Star Wars Story'], 'Affiliations': ['White Worms'], 'Locations': ['Corellia', ""White Worms' den""], 'Gender': ['Male'], 'Dimensions': ['Height: 1.73m '], 'species': ['Human'], 'Weapons': ['Rebolt’s Staff']}";
681;Rella Sol;The strategist of Titan Squadron, Rella Sol's parents both sat in the Imperial Senate before Emperor Palpatine consolidated power. Sol has inherited their political instincts and always keeps one eye on the bigger picture. While she's proud to serve, Sol's ambitions ultimately reach higher than piloting a TIE—perhaps even to a new senate. The renewed Empire will need not only strength but wisdom, and Sol is wise enough to bide her time.;;{};
682;Rey;Seemingly abandoned by her parents on Jakku, Rey grew up a scavenger amid the wreckage of war. Her life changed when she agreed to help a droid on an urgent mission for the Resistance. Rey discovered she was powerful in the Force, and sought out the vanished Jedi Master Luke Skywalker to train her. That ended in disappointment, as did her attempt to bring Kylo Ren back to the light. But the resilient Rey continued her training and learned the truth about her parentage and her mysterious connection with Kylo. She then faced her greatest test: a confrontation with fear and evil that would determine the galaxy’s fate.;['Jakku', 'BB-8', 'Resistance', 'astromech', 'Luke Skywalker', 'stormtrooper', 'Finn', 'Jakku', 'Takodana', 'Kylo Ren', 'Starkiller Base', 'Luke', 'Ahch-To', 'Jedi Order', 'Kylo', 'Luke', 'Ahch-To', 'Kylo', 'Supreme Leader Snoke', 'Resistance', 'Crait', 'Leia Organa', 'Jedi texts', 'Ahch-To', 'Emperor Palpatine', 'Jakku', 'Palpatine', 'Sith wayfinder', 'Exegol', 'Kef Bir', 'the Force', 'Palpatine', 'Exegol', 'Tatooine', 'Luke', 'Leia'];"{'Appearances': ['Star Wars: The Force Awakens (Episode VII)', 'Star Wars: The Last Jedi (Episode VIII)', 'Star Wars: The Rise of Skywalker (Episode IX)', 'Star Wars: Forces of Destiny'], 'Locations': ['Jakku', 'Goazon Badlands', ""Rey's Home""], 'Gender': ['Female'], 'Dimensions': ['Height: 1.7m '], 'species': ['Human'], 'Weapons': ['Lightsaber', 'Blaster Pistol', 'Skywalker lightsaber', ""Rey's Blaster"", ""Rey's Quarterstaff""], 'Vehicles': ['Millennium Falcon', 'X-wing Starfighter', ""Rey's Speeder""]}";
683;Ric Olie;A veteran of the Naboo Space Fighter Corps, Ric Olie was the leader of Bravo Flight and had the honor of flying Queen Amidala's Royal Starship to and from Naboo. Answerable directly to Captain Panaka, Olie was capable of flying any craft on Naboo.    During the Battle of Naboo, Olie's squadron of N-1 starfighters were successful in destroying the Trade Federation's Droid Control Ship with the help of Anakin Skywalker.;;{'Appearances': ['Star Wars: The Phantom Menace (Episode I)'], 'Affiliations': ['Naboo Royal Space Fighter Corps'], 'Locations': ['Naboo'], 'Gender': ['Male'], 'Dimensions': ['Height: 1.83m '], 'Vehicles': ['Naboo N-1 Starfighter', 'Naboo Royal Starship'], 'Weapons': ['Blaster Pistol']};
684;Rieve;Malicious and feared, this dark side warrior channels the power of the Force to crush her opponents beneath her heel. Filled with a reckless but powerful rage, Rieve lashes out at the other Hunters with her lightsaber with a vicious joy. This young fighter radiates danger, always keeping her opponents off-balance, but there’s a dark charisma that simultaneously draws you in.;;{};
685;Riff Tamson;A ravenous Karkarodon, Riff Tamson was a ruthless Separatist commander placed in charge of operations on the water world of Mon Cala. Count Dooku tasked him to disrupt the fragile peace between the Mon Calamari and the Quarren. Though present on the planet as a Separatist envoy, he secretly conspired with Quarren chieftain Nossor Ri to bring the Quarren into the war on the side of the Confederacy. Though Nossor believed he was doing what was best for his people, he had no idea of the true extent of Tamson's wicked plans.;;{'Appearances': ['Star Wars: The Clone Wars'], 'Affiliations': ['Confederacy of Independent Systems'], 'Locations': ['Karkaris'], 'Gender': ['Male'], 'Dimensions': ['Height: 2.21m '], 'species': ['Karkarodon']};
686;Rig Nema;A capable physician, Rig Nema served in the Jedi Temple on Coruscant during the last years of the Clone Wars, where her knowledge of biology and the Force helped her diagnose physical, mental and spiritual ailments. She examined Yoda after he reported hearing the voice of Qui-Gon Jinn, and supervised the Jedi Master’s participation in a dangerous procedure intended to induce meditation. The treatment was intended to discover the source of the voices Yoda had been hearing.;;{'Appearances': ['Star Wars: The Clone Wars'], 'Affiliations': ['Jedi Order'], 'Locations': ['Coruscant', 'Jedi Temple'], 'Gender': ['Female']};
687;Rio Durant;A diminutive, four-limbed Ardennian, Rio Durant is a longtime associate of Tobias Beckett and Val. Rio is a capable pilot, a skilled tactician, and a lover of good stories. He sees each new scam dreamed up by the Beckett gang’s as a chance to write a new tale.;['Tobias Beckett', 'Mimban', 'AT-Hauler', 'Val’', 'Han Solo', 'mudtrooper', 'Chewbacca', 'conveyex', 'Vandor', 'Enfys Nest', 'Cloud-Riders'];{'Appearances': ['Solo: A Star Wars Story'], 'Gender': ['Male'], 'Dimensions': ['Height: 1.49m '], 'species': ['Ardennian'], 'Vehicles': ['AT-Hauler']};
688;Rish Loo;The Gungans are a reverent people with a pantheon of gods looking over their lives. Priests can be extremely influential in Gungan society, though some have used such authority for their own gain. Minister Rish Loo is said to have many connections to ancient mystical powers, but where his true motives lie remain uncertain.;;{'Appearances': ['Star Wars: The Clone Wars'], 'Affiliations': ['Gungan High Council'], 'Locations': ['Naboo'], 'Gender': ['Male'], 'Dimensions': ['Height: 2.07m '], 'species': ['Gungan'], 'Vehicles': ['Speeder Bike', 'Gungan Bongo Submarine']};
689;Riyo Chuchi;Once a young and idealistic representative to Pantora in the Republic's Galactic Senate, Riyo Chuchi overcame her timidity, growing into a strong leader who once forced the Trade Federation into lifting a blockade over her home planet. After the rise of the Empire, Chuchi continues to uphold her beliefs in a fair and just government, forming an alliance with Bail Organa of Alderaan. When she learns that the devastation on Kamino was caused by Imperial fire, she will risk everything to expose the traitorous Vice Admiral Rampart on the senate floor.;['Pantoran', 'Galactic Republic', 'Chi Cho', 'Talz', 'Orto Plutonia', 'Trade Federation', 'Baron Papanoida'];{'Appearances': ['Star Wars: The Bad Batch', 'Star Wars: The Clone Wars'], 'Affiliations': ['Galactic Senate'], 'Locations': ['Pantora'], 'Gender': ['Female'], 'Dimensions': ['Height: 1.65m '], 'species': ['Pantoran']};
690;Robonino;A fish-like Patrolian, Robonino hired on with Cad Bane for a dangerous mission to infiltrate the Senate Building on Coruscant. The expert slicer proved up to the task, even ambushing and immobilizing a Jedi Knight.;;{'Appearances': ['Star Wars: The Clone Wars'], 'Gender': ['Male'], 'Dimensions': ['Height: 1.27m ']};
691;Roland Durand;The son of crime boss Isa Durand, Roland Durand hopes to make a name for himself in the galaxy by taking what he wants. Flanked by his hired goons, he joins forces with the Pyke Syndicate and sets up shop on Ord Mantell, using his powerful ties to usurp Cid's parlor for its prime location amid a web of hyperspace routes perfect for spice smuggling.;;"{'Appearances': ['Star Wars: The Bad Batch'], 'Locations': ['Ord Mantell', ""Cid's Parlor""], 'Gender': ['Male'], 'species': ['Devaronian']}";
692;Rolt;A regular at Aunt Z's tavern, Rolt is initially welcoming of the new presence of the First Order security forces protecting the Colossus. But as the number of soldiers escalates, individual freedoms are sacrificed and even an innocent walk around the platform can end in arrest.;;{'Appearances': ['Star Wars Resistance'], 'Locations': ['Colossus'], 'Gender': ['Male'], 'species': ['Gotal']};
693;Romar Adell;Romar Adell is one of the few native Serennians who remains after Dooku's loss in the Clone Wars. Fleeing into the woods in the aftermath, Romar ekes out an existence in hiding from the Empire.;;{'Appearances': ['Star Wars: The Bad Batch']};
694;Rose Tico;A maintenance tech with a talent for tinkering, Rose Tico joined the Resistance with her sister Paige after the First Order devastated her home system. A chance encounter with Finn pushed her onto the front lines of the new galactic civil war – and her sister’s death caused her to redouble her efforts for the Resistance cause.;['Paige', 'First Order', 'Resistance', 'bomber', 'Finn', 'Finn', 'First Order’s', 'Master Codebreaker', 'Canto Bight', 'police', 'fathiers', 'Finn', 'First Order', 'Resistance', 'Crait', 'ski speeders', 'battering-ram cannon', 'Millennium Falcon', 'Leia Organa', 'the Resistance', 'Emperor Palpatine'];{'Appearances': ['Star Wars: The Last Jedi (Episode VIII)', 'Star Wars: The Rise of Skywalker (Episode IX)'], 'Affiliations': ['The Resistance'], 'Gender': ['Female'], 'species': ['Human'], 'Vehicles': ['Resistance Transport Pod'], 'Weapons': ['Electro-shock prod'], 'token': ['Otomok Medallion']};
695;Rotta the Huttlet;Heir apparent to the Hutt empire, Jabba's infant son was barely old enough to slither before his conniving and power-hungry great-uncle, Ziro, already had him marked for death at the time of the Clone Wars. Ziro arranged for Rotta to be Huttnapped as part of an elaborate scheme to discredit the Jedi Knights and prevent them from entering an alliance with the Hutts.;;{'Appearances': ['Star Wars: The Clone Wars'], 'Locations': ['Tatooine'], 'Gender': ['Male'], 'Dimensions': ['Height: 0.43m '], 'species': ['Hutt']};
696;Ruby;A scaly pelt and wide, curious eyes make Ruby a perfect pet. After she was smuggled to Ord Mantell by Clone Force 99, the mysterious and hungry lizard-like creature became the companion of the crime lord Roland Durand.;;{'Appearances': ['Star Wars: The Bad Batch']};
697;Ruescott Melshi;Imprisoned by the Empire, Ruescott Melshi first met Cassian Andor as the two worked elbow-to-elbow at Table Five in the Imperial Narkina 5 facility. Within five years, Melshi would ascend the ranks to become a sergeant in the Rebel Alliance, continuing to work alongside Andor in the quest for freedom for the galaxy.;;{'Appearances': ['Andor']};
698;Rukh;A Noghri assassin, Rukh is an agile hand-to-hand fighter and exceptionally deadly. He loyally serves Grand Admiral Thrawn, handling missions that his master's Imperial subordinates have failed to complete.;;{'Appearances': ['Star Wars Rebels'], 'Gender': ['Male'], 'species': ['Noghri']};
699;Rumi Paramita;This female Frenk bounty hunter was a member of Sugi’s band of hunters, and was brought on to help defend the Felucian farming village that had come under attack by Hondo Ohnaka and his gang. As an expert sniper, she was positioned on a nearby roof, ready to snipe at the Weequay pirates as they launched their assault. She was killed at the hands of Hondo’s Kowokian Monkey Lizard Pikk Mukkmuk when he fired a cannon from Hondo’s tank.;;{'Appearances': ['Star Wars: The Clone Wars'], 'Affiliations': ['Bounty Hunters'], 'Locations': ['Felucia'], 'Gender': ['Female'], 'species': ['Frenk'], 'Weapons': ['Blaster Rifle']};
