;name;description;referrals;properties;history
443;King Katuunko;The sovereign ruler of the Toydarians, King Katuunko valued honesty above all else. He was chiefly concerned with protecting his people from the ravages of the Clone Wars, and was hesitant to ally himself to either the Republic or Separatist factions. After Master Yoda impressed Katuunko with a display of Jedi character, Katuunko committed his world to support the Republic.;;{'Appearances': ['Star Wars: The Clone Wars'], 'Affiliations': ['Galactic Republic'], 'Locations': ['Toydaria'], 'Gender': ['Male'], 'Dimensions': ['Height: 1.52m '], 'species': ['Toydarian']};
444;King Manchucho;The leader of the Aleena, King Manchucho was a fair and intelligent leader. He was gregarious and eager to please, always serving as a welcome host to any off-world guests. Manchucho wanted a peaceful coexistence with the beings that lived beneath the surface of his planet, even though their ways and culture remained alien to him.;;{'Appearances': ['Star Wars: The Clone Wars'], 'Affiliations': ['Galactic Republic'], 'Locations': ['Aleen'], 'Gender': ['Male'], 'Dimensions': ['Height: 0.78m '], 'species': ['Aleena']};
445;King Ramsis Dendup;As the galaxy began to split with the Separatist crisis that escalated into the Clone Wars, King Ramsis Dendup of Onderon looked on with disapproval and dread. The conflict would spill onto the borders of his home, and he would have to make a choice. But he saw no virtue in either the Republic or the Confederacy, recognizing the corruption that rotted within both governments. Dendup decided that the best course of action for his people would be to remain neutral in the conflict. For this, he was branded an indecisive coward and ousted from the throne by those who saw opportunity for change in power.;;{'Appearances': ['Star Wars: The Clone Wars'], 'Locations': ['Onderon'], 'Gender': ['Male'], 'Dimensions': ['Height: 1.68m ']};
446;King Sanjay Rash;King Ramsis Dendup refused to commit Onderon to the Clone Wars, thinking that neutrality would spare the planet from the violent conflict. Sanjay Rash knew better. To ensure Onderon's prosperity and strength in the shifting galaxy would require a strong alliance -- and that meant striking an accord with the Separatists. Through methods cloaked in intrigue, Rash assumed the crown of Onderon, deposing Dendup and branding him a powerless old crone. Rash then allowed the Separatists to establish a firm foothold, cementing his rule of the planet.;;{'Appearances': ['Star Wars: The Clone Wars'], 'Affiliations': ['Confederacy of Independent Systems'], 'Locations': ['Onderon'], 'Gender': ['Male'], 'Dimensions': ['Height: 1.74m '], 'Weapons': ['Blaster Pistol']};
447;Kino Loy;Kino Loy has adapted to life inside Imperial lock-up. As the floor manager inside the Narkina 5 facility, he maintains order among his fellow inmates, barking commands to ensure a quality performance that will benefit everyone on the cell block. Inside his cell on the off hours, Loy counts down the days until he will once again enjoy the life of a free man.;;{'Appearances': ['Andor']};
448;Kit Fisto;Kit Fisto is a striking example of an alien Jedi, a Nautolan with large eyes, and a gathered tangle of flexible tentacle-tresses extending from his head. He is at home in the waters of aquatic planets, like his native Glee Anselm. As a Jedi Master, Fisto has an intense focus, particularly in combat. He is also much more laid back and capable of enjoying a hearty chuckle than some of his humorless colleagues.;['Nautolan', 'Republic', 'Geonosis', 'Separatist', 'droids', 'Mon Cala', 'Prince Lee-Char', 'lightsaber'];{'Appearances': ['Star Wars: Attack of the Clones (Episode II)', 'Star Wars: Revenge of the Sith (Episode III)', 'Star Wars: The Clone Wars'], 'Affiliations': ['Jedi Order'], 'Locations': ['Glee Anselm'], 'Gender': ['Male'], 'Dimensions': ['Height: 1.96m '], 'species': ['Nautolan'], 'Weapons': ['Lightsaber'], 'Vehicles': ['Jedi Starfighter']};
449;Kitster;Kitster was one of Anakin Skywalker's friends before the young podracing champ left Tatooine for the life of a Jedi. An optimistic human boy about the same age as Anakin, Kitster was part of Anakin's pit team in the fateful Boonta Eve Classic race that saw young Skywalker win his freedom.;;{'Appearances': ['Star Wars: The Phantom Menace (Episode I)'], 'Locations': ['Tatooine'], 'Gender': ['Male'], 'Dimensions': ['Height: 1.24m ']};
450;Kitwarr;Kitwarr was a young Wookiee captured by Imperials and forced to work in the spice mines of Kessel. After a daring rescue by the crew of the Ghost, he and his father, Wulffwarro, were set free.;;{'Appearances': ['Star Wars Rebels'], 'Gender': ['Male']};
451;Klaatu;A Kadas’sa’Nikto from Kintan, Klaatu was a henchman of Jabba the Hutt, and spent his time at the Hutt’s palace repairing skiffs, eagerly awaiting executions and amassing ever-larger gambling debts. Klaatu confronted Luke Skywalker during the battle at the Great Pit of Carkoon, but fled after Luke disarmed him with a stroke of his lightsaber. He died when Jabba’s sail barge exploded.;;{'Appearances': ['Star Wars: Return of the Jedi (Episode VI)'], 'Locations': ['Tatooine', 'Kintan'], 'Gender': ['Male'], 'species': ['Nikto (Green)'], 'Weapons': ['Blaster Pistol']};
452;Klaud;Klaud might have joined the Resistance as a result of mistaken identity, but he is welcomed as an ally by the freedom fighters. ;;{'Appearances': ['Star Wars: The Rise of Skywalker (Episode IX)']};
453;Kleya Marki;The concierge at Luthen Rael's Galactic Antiquities and Objects of Interest gallery, Kleya Marki is a master of disguise. At the shop, Kleya works out front assisting customers and restoring precious artifacts. But when called upon, she is the perfect emissary, messenger, and enforcer, for Luthen's spy operation, with a highly attenuated intuition and unflinching commitment to the rebel cause.;;{'Appearances': ['Andor']};
454;Klik-Klak;"Klik-Klak was the lone Geonosian survivor following the Empire's eradication of his people. He hid in the Geonosis caves, fearful of outsiders, and used battle droids left over from the Clone Wars as a means of protection. But he wasn't just protecting himself; Klik-Klak was the keeper of a queen egg, which could be the key to rebuilding his kind.";;{'Appearances': ['Star Wars Rebels'], 'Locations': ['Geonosis'], 'Gender': ['Male'], 'Dimensions': ['Height: 1.75m '], 'species': ['Geonosian']};
455;Korkie Kryze;The nephew of Duchess Satine Kryze, Cadet Korkie attended the Royal Academy of Government on Mandalore, where he was being groomed for leadership. His keen insights and ambitious personality suggested that he would go far. Together with his friends Soniee, Amis, and Lagos, Korkie helped expose corruption in the highest levels of government, and later helped rescue his aunt from wrongful imprisonment during the rise of the Shadow Collective.;;{'Appearances': ['Star Wars: The Clone Wars'], 'Locations': ['Mandalore'], 'Gender': ['Male'], 'Dimensions': ['Height: 1.65m ']};
456;Korr Sella;The capable, no-nonsense Korr Sella assisted Leia Organa during her career in the New Republic’s Galactic Senate and remained in her service when Leia left politics to establish the Resistance. Sella served as Leia’s link to the Senate, bringing intelligence to allies and supporters who agreed with her warnings about the First Order. Sella was on Hosnian Prime as Leia’s envoy when the Starkiller superweapon destroyed the system, ending her life.;;"{'Appearances': ['Star Wars: The Force Awakens (Episode VII)'], 'Affiliations': ['The Resistance'], 'Locations': [""D'Qar""], 'Gender': ['Female'], 'Dimensions': ['Height: 1.65m '], 'species': ['Human']}";
457;Kragan Gorr;The notorious pirate Kragan Gorr has a reputation for leading ruthless attacks under the cover of environmental threats. In addition to his pirate gang and associates feeding him important tactical intelligence, Kragan is secretly in league with the First Order.;['the First Order', 'Torra Doza', 'Synara San', 'Kazuda Xiono', 'Colossus', 'Doza Tower', 'Colossus', 'Captain Doza', 'jakoosk', 'Sidon Ithano', 'Colossus', 'super battle droids', 'Captain Doza', 'Neeku'];{'Appearances': ['Star Wars Resistance'], 'Gender': ['Male']};
458;Krismo Sodi;Krismo was the most skilled and deadly member of the Kage Warriors, serving as their leader at the time of the Clone Wars. From atop a galloping milodon, he led his warriors through the subterranean caverns of Quarzite against the Belugan forces of Lord Otua Blank.;;{'Appearances': ['Star Wars: The Clone Wars'], 'Affiliations': ['Kage Warriors'], 'Locations': ['Quarzite'], 'Gender': ['Male'], 'Dimensions': ['Height: 1.89m '], 'species': ['Kage']};
459;Krrsantan;A former gladiator turned deadly bounty hunter, Krrsantan is a towering black-furred Wookiee. During the Empire's rule, he made a name for himself in the criminal underworld with his intimidating presence and unstoppable raw strength.;;"{'Appearances': ['The Book of Boba Fett'], 'Locations': ['Tatooine'], 'species': ['Wookiee'], 'Weapons': [""Krrsantan's knuckle dusters""]}";
460;Kuiil;A vapor farmer on Arvala-7, Kuiil came to seek peace in an out of the way world, which is now being trespassed upon by criminals and mercenaries. He has worked a lifetime to be free of servitude, and offers valuable skills for those willing to meet his price.;;{'Appearances': ['The Mandalorian'], 'Gender': ['Male'], 'species': ['Ugnaught']};
461;Kuruk;A gifted sniper, Kuruk is the most solitary of the Knights of Ren, preferring to cover the group’s assaults from a carefully chosen vantage point above the battlefield. He also serves as pilot of the Night Buzzard.;;{'Appearances': ['Star Wars: The Force Awakens (Episode VII)', 'Star Wars: The Rise of Skywalker (Episode IX)'], 'Affiliations': ['Knights of Ren'], 'Gender': ['Male'], 'Vehicles': ['Night Buzzard'], 'Weapons': ['Kuruk’s blaster rifle']};
462;L3-37;A self-made droid built from astromech and protocol parts, L3-37 is an enlightened navigator who cares deeply about droid rights. Her ability to connect directly with the Millennium Falcon’s navicomputer lets the freighter plot faster routes than those traveled by more cautious ships. L3-37’s habit of speaking her mind and her relentless advocacy for mechanicals can alienate organic beings.;['Millennium Falcon', 'Lando Calrissian', 'Beckett', 'Kessel'];{'Appearances': ['Solo: A Star Wars Story'], 'Dimensions': ['Height: 1.79m '], 'droid': ['custom piloting droid']};
463;Lady Proxima;The fearsome Grindalid matriarch of the White Worms, Lady Proxima rules Corellia’s black market from a tangle of sewer tunnels beneath Corellia’s Coronet City. A briny pool serves as a throne room where Proxima feeds her hatchlings and commands the urchins known as scrumrats, sending them out to pick pockets and barter stolen goods.;;"{'Appearances': ['Solo: A Star Wars Story'], 'Affiliations': ['White Worms'], 'Locations': ['Corellia', ""White Worms' den""], 'Gender': ['Female'], 'Dimensions': ['Height: 4.88m '], 'species': ['Grindalid']}";
464;Lagos;During the Clone Wars, Lagos attended the prestigious Mandalorian Royal Academy of Government, an institution that grooms the best and brightest of Mandalorian youth to help steer the future of the planet. This future, however, was dominated by the influence of criminal interlopers. First, the unscrupulous Prime Minister Almec embroiled the planet in the black market. Lagos was one of the cadets led by Korkie Kryze who helped expose this plot. A cautious student, she sometimes found the adventure-seeking nature of her classmates overwhelming. She would find courage when circumstances demanded it, however, even piloting the escape speeder during a brash jail break that freed the wrongly imprisoned Duchess Satine Kryze.;;{'Appearances': ['Star Wars: The Clone Wars'], 'Affiliations': ['Galactic Republic'], 'Locations': ['Mandalore'], 'Gender': ['Female']};
465;Lama Su;An ancient creature accidentally unearthed on Malastare during an intense battle of the Clone Wars, the zillo beast was a monster of legend. The enormous animal proved to be nearly invulnerable to Republic weaponry, prompting intense interest from then-Chancellor Palpatine. At his order, the creature was incapacitated and transported to a secure research facility on Coruscant, before it broke free and terrorized the capital. In the era of the Empire, Emperor Palpatine's scientists continue to work on harnessing the species' natural gifts, with disastrous consequences. On one occasion, an Imperial craft carrying a modified version of the creature crash-landed on the world of Silla, leaving the modified zillo to blindly hunt for power sources, gulping at energy conduits to propel its rapid growth, and feasting on one of the planet's solar farms.;;{'Appearances': ['Star Wars: Attack of the Clones (Episode II)', 'Star Wars: The Bad Batch', 'Star Wars: The Clone Wars'], 'Locations': ['Kamino'], 'Gender': ['Male'], 'Dimensions': ['Height: 2.29m '], 'species': ['Kaminoan']};
466;Lando Calrissian;Lando Calrissian may have come late to the fight against the Empire, but his role in destroying the second Death Star cemented his reputation as a hero. In his youth, Lando was a sportsman seeking a fortune at the sabacc tables. After he lost his beloved ship to Han Solo, Lando spent years living the high life and pursuing get-rich-quick schemes, with uneven results. He went semi-respectable as the baron administrator of Cloud City, only to be drawn into the fight against the Empire. After a personal tragedy, Lando sought solace in isolation on Pasaana, unaware that the galaxy would need him again.;"['Vandor', 'Millennium Falcon', 'Han Solo', 'Kessel', 'L3-37', 'sabacc', 'Numidian Prime', 'Lothal', ""Old Jho's"", 'sabacc', 'Zeb Orrelios', 'the Ghost', 'Lasat', 'Chopper', 'astromech', 'Azmorigan', 'Hera', 'puffer pig', ""Twi'lek"", 'Cloud City', 'Bespin', 'Empire', 'Darth Vader', 'stormtroopers', 'Boba Fett', 'hyperdrive', 'Leia', 'Chewbacca', 'Jabba the Hutt', 'palace', 'Tatooine', 'Jabba’s sail barge', 'Death Star', 'Pasaana', 'Aki-Aki', 'Emperor Palpatine', 'Chewbacca', 'Exegol']";{'Appearances': ['Star Wars: The Empire Strikes Back (Episode V)', 'Star Wars: Return of the Jedi (Episode VI)', 'Solo: A Star Wars Story', 'Star Wars: The Rise of Skywalker (Episode IX)', 'Star Wars Rebels'], 'Affiliations': ['Rebel Alliance', 'The Resistance'], 'Locations': ['Cloud City', 'Bespin', 'Numidian Prime', 'Pasaana'], 'Gender': ['Male'], 'Dimensions': ['Height: 1.78m '], 'species': ['Human'], 'Vehicles': ['Millennium Falcon'], 'Weapons': ['SE-14 blaster pistol']};
467;Lanse Crowder;A slick pirate who deals in rare antiquities and other exotic finds, Lanse Crowder is not above peddling knockoffs and poisoning his patrons if it means he can sell a single item more than once and reap the profits. In negotiations with the discerning Phee Genoa, Lanse discovers his henchmen are no match for her new crew — Omega, Wrecker, and Hunter.;;{'Appearances': ['Star Wars: The Bad Batch']};
468;Latts Razzi;Beautiful and deadly, Latts Razzi was a Theelin bounty hunter who operated during the Clone Wars. Used to high style and first class comforts, Razzi charged exorbitant rates but had the skills to back them. Aside from her pinpoint accuracy with a blaster pistol, she was an expert unarmed fighter in several forms of exotic combat. Draped around her shoulders were triple rows of a scaled boa, which when snapped like a whip or lariat, proved to be much more than a fashion accessory.;;{'Appearances': ['Star Wars: The Clone Wars'], 'Gender': ['Female'], 'Dimensions': ['Height: 1.79m '], 'species': ['Theelin'], 'Weapons': ['Blaster Pistol']};
469;LE-12;Meandering about the Colossus on two springy legs, this older model LE-series droid performs a variety of functions for various mechanics and salvagers on the platform, thanks to a trusty pair of clamps and a head unit that can spin around 360 degrees.;;{'Appearances': ['Star Wars Resistance'], 'Locations': ['Colossus'], 'star wars': ['Droid']};
470;Lechee;Like any slimy businessman, Lechee knows how to turn on the charm while trying to usher new customers into his shop in the Vargo marketplace. But once out of sight and earshot, his demeanor turns to something more sinister in the hopes of making a quick credit.;;{'Appearances': ['Star Wars Resistance'], 'Gender': ['Male'], 'species': ['Gran']};
471;Leia Organa;Princess Leia Organa was one of the greatest leaders of the Rebel Alliance, fearless on the battlefield and dedicated to ending the Empire’s tyranny. Daughter of Padmé Amidala and Anakin Skywalker, sister of Luke Skywalker, and with a soft spot for scoundrels, Leia ranked among the galaxy’s great heroes. But life under the New Republic proved difficult for her. Sidelined by a new generation of political leaders, she struck out on her own to oppose the First Order as founder of the Resistance. These setbacks in her political career were accompanied by more personal losses, which she endured with her seemingly inexhaustible will.;"['Padmé Amidala', 'Anakin Skywalker', 'Naboo', 'Luke', 'Bail Organa', 'Alderaan', 'Daiyu', 'Phoenix Squadron', 'Lothal', 'Ghost', 'Kanan', 'Ezra', 'Empire', 'Death Star', 'Scarif', 'Tantive IV', 'Tantive IV', 'Death Star', 'Empire’s', 'Rebel Alliance’s', 'Darth Vader', 'R2-D2', 'C-3PO', 'stormtroopers', 'Grand Moff Tarkin', 'interrogation droid', 'Yavin 4', 'Tatooine', 'Obi-Wan Kenobi', 'Han Solo', 'Chewbacca', 'Millennium Falcon', 'X-wing', 'TIE fighters', 'Hoth', 'Cloud City', 'Lando Calrissian', 'Boba Fett', ""Jabba's Palace"", 'Jabba', 'Sarlacc', 'Death Star', 'Endor', 'Imperial shuttle', 'scout troopers', 'speeder bikes', 'Ewok', 'Wicket', 'Emperor', 'Endor', 'New Republic', 'Galactic Empire', 'Resistance', 'Resistance', 'irst Order', 'Poe Dameron', 'Kazuda Xiono', 'Colossus', 'Hosnian Prime', 'First Order', 'New Republic', 'Hosnian', 'Starkiller', 'Resistance', 'Kylo Ren', 'Raddus', 'Crait', 'Resistance', 'Resistance', 'Luke', 'Rey', 'the Force', 'the Force', 'Ajan Kloss']";{'Appearances': ['Star Wars: A New Hope (Episode IV)', 'Star Wars: The Empire Strikes Back (Episode V)', 'Star Wars: Return of the Jedi (Episode VI)', 'Star Wars: Revenge of the Sith (Episode III)', 'Star Wars: The Force Awakens (Episode VII)', 'Rogue One: A Star Wars Story', 'Star Wars: The Last Jedi (Episode VIII)', 'Obi-Wan Kenobi', 'Star Wars Resistance', 'Star Wars Rebels'], 'Affiliations': ['Rebel Alliance', 'The Resistance', 'Galactic Senate', 'Alderaan Royal Family'], 'Locations': ['Alderaan', 'Polis Massa', 'Crait'], 'Gender': ['Female'], 'Dimensions': ['Height: 1.5m '], 'species': ['Human'], 'Vehicles': ['Tantive IV', 'The Raddus'], 'Weapons': ['Blaster Pistol']};
472;Leida Mothma;At 13, Leida Mothma is already nursing a rebellious streak. The daughter of Senator Mon Mothma and her husband Perrin Fertha, Leida spends much of her time on Coruscant, but resents her mother's focus on her political career. Instead, Leida prefers the simplicity of Chandrilan customs, a surprise to her mother who regards many of the traditions as outdated in modern times.;;{'Appearances': ['Andor']};
473;Lens Kamo;A fervent student of history and professional treasure hunter formerly employed by the cybernetics mogul, Baron Attsmun. She went into treasure hunting with the sole purpose of getting artifacts out of sites without harming them, and keeping them out of reach of the destructive collectors -- by any means necessary. ;;{'Locations': ['Batuu', 'Black Spire Outpost']};
474;Leox;"Leox Gyasi is the charming, rogue pilot of the Vessel who may or may not have a fondness for spice. Despite his undeniable good looks, romantic and sexual encounters are not imperative to him; in fact, he identifies as asexual. His primary focus is piloting the Vessel with his navigator, Geode, or the Byne Guild.";;{'Appearances': ['Star Wars: The High Republic']};
475;Leoz;A member of Kragan Gorr's pirate gang, when he isn't pillaging and plundering Leoz spends his time gambling with his lucky pair of dice. A sore loser, he has been known to place a curse on his opponent after a bad match.;;{'Appearances': ['Star Wars Resistance'], 'Gender': ['Male'], 'species': ['Nikto']};
476;Letta Turmond;Hardened by a life in the working class levels of Coruscant, Letta Turmond had a jaundiced view of the Jedi Order and the leadership of the Galactic Republic. Her husband, Jackar Bowmani, was a technician who worked in the Jedi Temple, and devoted his life to supporting the Order. With the outbreak of the Clone Wars, Bowmani's expertise was used to arm Republic gunships, and it galled Letta to see what was once an institution of peace and justice transformed into an instrument of war. She became an activist opposed to the Jedi involvement of the war, but her beliefs were so radical that they crossed the line into terrorism.;;{'Appearances': ['Star Wars: The Clone Wars'], 'Locations': ['Coruscant'], 'Gender': ['Female']};
477;Liana Kor;"Known as ""Iron"" Liana, her associates in the smuggling business often describe Kor as ""stubborn as a zakkeg, and twice as mean."" Liana Kor often finds herself entangled in conflicts between the Rebel Alliance and the Empire, as she often targets arms shipments for her pirating and smuggling operations. She has no love for either side, and will often attempt to play both sides to get what she wants. This hasn't earned her much respect, but is widely know not to be trifled with, as she lives up to her nickname.";;"{'Locations': ['Nar Shaddaa'], 'Gender': ['Female'], 'species': [""Twi'lek""]}";
478;Lieutenant Bolandin;A veteran Imperial, Bolandin has long regarded Corporal Han Solo as a troublemaker with a big mouth – and the mudtroopers battling on Mimban have trouble enough as it is. When Solo is turned over to Bolandin as a deserter, he orders stormtroopers to throw him in with “the Beast” – a Wookiee prisoner held in a makeshift prison.;;{'Appearances': ['Solo: A Star Wars Story'], 'Affiliations': ['Galactic Empire'], 'Locations': ['Mimban'], 'Gender': ['Male'], 'Dimensions': ['Height: 1.88m '], 'species': ['Human']};
479;Lieutenant Dicer;One of the rebellion's pilots, Lieutenant Dicer was among the first to try to set up a base on Atollon. Unfortunately for Dicer, the world was not as desolate as believed -- huge spider-like creatures called krykna lived below the surface. After the krykna attacked, all that was left of Dicer was her helmet.;;{'Appearances': ['Star Wars Rebels'], 'Affiliations': ['Phoenix Squadron'], 'Gender': ['Female'], 'species': ['Human']};
480;Lieutenant Galek;With an ever-present scowl to match the rest of her severe demeanor, First Order flight instructor Lieutenant Galek has little patience for the antics of cadets who fail to follow basic orders. Known for her harsh tactics, on the training field she believes strongly in survival of the fittest, utilizing live fire instead of stun blasts to most effectively approximate real battle situations and doling out firm but fair punishments. In Galek's view, the First Order thrives by culling the weak so only the strongest survive.;;{'Appearances': ['Star Wars Resistance'], 'Affiliations': ['The First Order'], 'Gender': ['Female'], 'species': ['Human']};
481;Lieutenant Mitaka;A young officer in the First Order Navy, Dopheld Mitaka graduated at the top of his Academy class and received a coveted post aboard the Finalizer. It was a plum assignment Mitaka would sometimes regret, as his duties included telling Kylo Ren of the First Order’s failure to capture the fugitive Resistance droid BB-8.;;{'Appearances': ['Star Wars: The Force Awakens (Episode VII)'], 'Affiliations': ['The First Order'], 'Gender': ['Male'], 'species': ['Human'], 'Vehicles': ['Finalizer']};
482;Lieutenant Mytus Adema;Mytus Adema is an ambitious young officer assigned to the Scarif Citadel. He disdains his senior officer, General Ramda, as lazy and overconfident, and hopes to supplant him in the eyes of Director Krennic. Adema sees the Death Star as a welcome symbol of Imperial glory and might.;;{'Appearances': ['Rogue One: A Star Wars Story'], 'Affiliations': ['Galactic Empire'], 'Locations': ['Scarif'], 'Gender': ['Male'], 'species': ['Human']};
483;Lindon Javes;An experienced pilot and instructor, Lindon Javes rose through the ranks of the Rebellion after the destruction of Alderaan by hunting Imperial capital ships. Though he's still a combat pilot at heart, Lindon found he had a knack for command, coordinating several successful missions behind Imperial lines. Now, as the galactic war enters a new phase, Lindon has been given command of his own squadron, and a classified assignment for the New Republic.;;{};
484;Lobot;Never far from Baron Administrator Lando Calrissian's side was Lobot, Calrissian's aide and Cloud City's computer liaison officer. Lobot is a human male with a shiny, brain-enhancing device wrapped around the back of his skull that allowed him to contact directly with the city's central computer.;;{'Appearances': ['Star Wars: The Empire Strikes Back (Episode V)'], 'Locations': ['Cloud City'], 'Gender': ['Male'], 'Dimensions': ['Height: 1.75m '], 'species': ['Human'], 'Tool': ['Lobot-Tech Headgear']};
485;Loden Greatstorm;Loden is a Twi'lek Jedi Master, and is considered to be one of the best teachers in the Jedi Order. Strong and wise, with a good sense of humor, Loden looks at every moment as a learning experience, always trying to better himself and those around him, especially his Padawans.;;{'Appearances': ['Star Wars: The High Republic']};
